title,content,date,link
CBE Returns to Profit After Seven Years of Losses,"– The Central Bank of Egypt (CBE) reported a profit of EGP 22.83 billion ($468.71 million) for the fiscal year 2023/2024, marking its first profit in seven years after a previous loss of EGP 86.28 billion.

– The bank’s total assets increased by 35% to EGP 6.1 trillion, and its gold reserves surged by 91% to EGP 454.92 billion by June 2024.

– In response to a directive from Prime Minister Mostafa Madbouly, the CBE stopped funding subsidized loans and transferred this responsibility to the ministries of finance, housing, and tourism.

The Central Bank of Egypt (CBE) reported a profit of EGP 22.83 billion ($468.71 million) for the fiscal year 2023/2024, marking its first profit in seven years. This comes after a significant loss of EGP 86.28 billion in the previous fiscal year.

The last time the CBE reported a profit was in the fiscal year 2016-2017, when it posted EGP 12.66 billion. In November 2022, the bank ceased support for various government initiatives to reduce its losses, following a directive from Prime Minister Mostafa Madbouly.

The decree instructed the CBE to stop financing subsidized loans and transfer this responsibility to the ministries of finance, housing, and tourism.

During the past fiscal year, CBE’s total assets rose by 35%, reaching EGP 6.1 trillion, up from EGP 4.5 trillion the previous year.

Additionally, the bank’s gold reserves surged by 91% to EGP 454.92 billion by the end of June 2024, compared to EGP 238.6 billion in the same period last year, according to Ashraq Business, an Arabic financial portal.

Egypt’s fiscal year runs from July 1 to June 30.",2024-08-29,https://waya.media/cbe-returns-to-profit-after-seven-years-of-losses/
Saudi E-commerce Startups Secure Over USD 400M in Venture Funding in 2023,"– Saudi e-commerce startups attracted SR1.6 billion ($426.7 million) in venture capital funding in 2023, signaling robust sector growth.

– E-commerce platform users in Saudi Arabia are expected to reach 34.5 million by 2025, reflecting a 42 percent increase from 2019.

– E-commerce is set to contribute 12 percent to Saudi Arabia’s GDP by 2025, with 80 percent of transactions anticipated to be electronic by 2030.

Saudi Arabia’s e-commerce sector is experiencing significant growth, with venture capital investments in startups reaching SR1.6 billion ($426.7 million) in 2023, according to official data.

A report by the Small and Medium Enterprises General Authority (Monsha’at) forecasts that the number of e-commerce platform users in the Kingdom will hit 34.5 million by 2025, marking a 42 percent increase from 2019 to 2024.

This growth highlights the sector’s pivotal role in the Kingdom’s economic diversification strategy. The transformation of Saudi Arabia’s digital marketplace is part of a broader national effort to promote innovation and boost economic development.

The formation of the E-Commerce Council in 2018 was a strategic step to advance the sector, focusing on financial technology, payment solutions, and logistics improvements. These initiatives have positioned Saudi Arabia as one of the most dynamic e-commerce markets in the Middle East and North Africa.

In 2020, e-commerce accounted for 4 percent of the Kingdom’s GDP, with online purchases comprising 8 percent of goods and 25 percent of services, according to Muhannad Al-Mulhim, a consultant at the Ministry of Commerce. By year-end, e-commerce revenues are anticipated to reach SR211 billion. Despite this rapid expansion, e-commerce currently represents only 18 percent of total retail sales, indicating significant potential for growth.

Looking ahead, the sector is expected to contribute 12 percent to GDP by 2025, with a targeted compound annual growth rate of 15 percent from 2020 to 2025.

Al-Mulhim said: “According to the E-Commerce Council, developments in several key sectors, including infrastructure and the legislative environment, have been driven by programs under Saudi Vision 2030, such as the e-commerce stimulus program. This led to the issuance of the e-commerce system by the Ministry of Commerce.”

He added: “Additionally, the financial sector development program, in cooperation with the Saudi Central Bank, has resulted in a comprehensive development of the financial technology sector and prompted several transformations in the logistics services sector.”

By 2030, 80 percent of transactions in Saudi Arabia are projected to be conducted electronically, in line with the objectives of Vision 2030. As the Kingdom advances its ambitious agenda, the e-commerce sector is poised to be a key driver of economic diversification, innovation, and new business opportunities.",2024-08-29,https://waya.media/saudi-e-commerce-startups-secure-over-usd-400m-in-venture-funding-in-2023/
